{
  "$schema": "https://raw.githubusercontent.com/Sakura-wcs/Javinizer_web_zh/main/translations/schema.json",
  "name": "Javinizer Web 简体中文翻译",
  "locale": "zh-CN",
  "version": "0.2.3",
  "updated": "2026-06-19",
  "notes": [
    "精确词条用于稳定 UI 文案。",
    "patterns 用于计数、状态和动态短句。",
    "不要加入影片标题、演员名、文件路径或日志详情。"
  ],
  "exact": {
    "Javinizer": "Javinizer",
    "Dashboard": "控制台",
    "Scrape": "刮削",
    "Jobs": "任务",
    "Actresses": "演员",
    "Genres": "类型",
    "Words": "词库",
    "Logout": "退出登录",
    "Login Required": "需要登录",
    "Sign in with your configured username and password.": "请使用已配置的用户名和密码登录。",
    "Username": "用户名",
    "Password": "密码",
    "Remember me": "记住我",
    "Keep this browser signed in across browser and server restarts for the normal session lifetime.": "在常规会话有效期内，即使浏览器或服务器重启也保持登录。",
    "Sign In": "登录",
    "root · Logout": "root · 退出登录",
    "Javinizer Control Center": "Javinizer 控制中心",
    "Run scraping workflows, monitor system health, and jump back into recent jobs.": "运行刮削流程、查看系统状态，并快速回到最近任务。",
    "Start Scrape": "开始刮削",
    "Recent History": "最近历史",
    "Manage Actresses": "管理演员",
    "Settings": "设置",
    "Current Activity": "当前活动",
    "Refresh dashboard": "刷新控制台",
    "No recent job activity yet.": "暂无最近任务活动。",
    "Go to Browse": "前往浏览",
    "WS connected": "WebSocket 已连接",
    "Total Operations": "总操作数",
    "Success Rate (7d)": "7 天成功率",
    "Failures (7d)": "7 天失败数",
    "Actresses in DB": "数据库演员数",
    "Recent Runs": "最近运行",
    "Open Full History": "打开完整历史",
    "Setup Health": "配置健康状态",
    "API Connectivity": "API 连通性",
    "Backend reachable": "后端可访问",
    "WebSocket Stream": "WebSocket 流",
    "Real-time updates enabled": "实时更新已启用",
    "Scrapers Configured": "已配置刮削器",
    "Output Path": "输出路径",
    "Destination path is saved": "目标路径已保存",
    "Path Shortcuts": "路径快捷入口",
    "Working Directory": "工作目录",
    "Input Path": "输入路径",
    "Open Browse": "打开浏览",
    "API Docs": "API 文档",
    "Dashboard ready": "控制台已就绪",
    "Browse & Scrape": "浏览与刮削",
    "Select video files and scrape metadata from configured sources": "选择视频文件，并从已配置来源刮削元数据。",
    "Reset Paths": "重置路径",
    "Operation Mode": "操作模式",
    "Scrape & Organize": "刮削并整理",
    "Scrape metadata and organize files into destination folder with artwork and NFO": "抓取元数据，并将文件整理到目标文件夹，同时生成封面图和 NFO。",
    "Update Metadata": "更新元数据",
    "Update metadata and media files in place, video files remain where they are": "就地更新元数据和媒体文件，视频文件保持原位置。",
    "File Operations": "文件操作",
    "Choose how files are organized during scraping": "选择刮削过程中如何整理文件。",
    "Organize": "整理",
    "Move to folder": "移动到文件夹",
    "Default": "默认",
    "Reorganize in place": "就地重组",
    "Keep location, rename folder and file": "保留位置，重命名文件夹和文件。",
    "Rename file only": "仅重命名文件",
    "Rename video file, keep folder": "重命名视频文件，保留文件夹。",
    "Metadata & Artwork": "元数据与图片",
    "No file changes": "不改动文件",
    "Output Destination": "输出目标",
    "Enter destination path (e.g., /path/to/output)": "输入目标路径，例如 /path/to/output",
    "Browse": "浏览",
    "Scraped files will be organized with metadata, artwork, and NFO files in this directory": "刮削后的文件会在此目录中按元数据、图片和 NFO 整理。",
    "Go to root": "前往根目录",
    "Go up": "返回上级",
    "Refresh": "刷新",
    "Enter path (e.g., /path/to/videos)": "输入路径，例如 /path/to/videos",
    "Navigate to path": "跳转到路径",
    "Filter files and folders...": "筛选文件和文件夹...",
    "Sort by:": "排序方式：",
    "Name": "名称",
    "Modified": "修改时间",
    "Size": "大小",
    "Select All": "全选",
    "Clear": "清空",
    "How to use:": "使用方法：",
    "1. Select operation mode: (choose move/copy/hard link/soft link during review) or (files stay in place)": "1. 选择操作模式：（在检查阶段选择移动/复制/硬链接/软链接）或（文件保留原位）。",
    "2. Navigate to your video files using the file browser (type a path or click folders)": "2. 使用文件浏览器定位视频文件（输入路径或点击文件夹）。",
    "3. Click to find JAV files (enable to include subfolders)": "3. 点击扫描 JAV 文件（启用递归可包含子文件夹）。",
    "4. Configure options (force refresh, scraper selection) in the bottom bar as needed": "4. 按需在底部栏配置选项（强制刷新、刮削器选择等）。",
    "5. Click the action button to start the operation": "5. 点击操作按钮开始执行。",
    "Use the filter box to narrow down files, then scan to select only matching results.": "使用筛选框缩小文件范围，再扫描以只选择匹配结果。",
    "Tip:": "提示：",
    "No files selected": "未选择文件",
    "Scan current folder only": "仅扫描当前文件夹",
    "Scan": "扫描",
    "Recursive": "递归",
    "Options": "选项",
    "Scrape 0 Files": "刮削 0 个文件",
    "Manage your batch jobs and organize history": "管理批量任务和整理历史。",
    "Clear All": "全部清除",
    "Clear all completed, failed, cancelled jobs": "清除所有已完成、失败和已取消任务。",
    "New Scrape": "新建刮削",
    "Older than": "早于",
    "days": "天",
    "Clean History": "清理历史",
    "Clean Events": "清理事件",
    "All": "全部",
    "Running": "运行中",
    "Failed": "失败",
    "Ready": "待整理",
    "Cancelled": "已取消",
    "Organized": "已整理",
    "Reverted": "已回滚",
    "Review & Organize": "检查并整理",
    "Review Failed": "查看失败项",
    "View failed files in review": "在检查页面查看失败文件",
    "Dismiss": "忽略",
    "Actress Database": "演员数据库",
    "Create, update, and remove actress records stored in the database.": "创建、更新和删除数据库中的演员记录。",
    "Export": "导出",
    "Import": "导入",
    "New Actress": "新建演员",
    "Create Actress": "创建演员",
    "Create Mode": "创建模式",
    "Fill in details to add a new actress record.": "填写信息以添加新的演员记录。",
    "DMM ID": "DMM ID",
    "e.g. 1092662": "例如 1092662",
    "Optional. Leave blank if unknown.": "可选；不知道可以留空。",
    "First Name": "名",
    "Last Name": "姓",
    "Japanese Name": "日文名",
    "Thumbnail URL": "缩略图 URL",
    "Aliases": "别名",
    "Create": "创建",
    "Search actresses": "搜索演员",
    "Search by English or Japanese name": "按英文名或日文名搜索",
    "Search": "搜索",
    "Cards": "卡片",
    "Compact": "紧凑",
    "Table": "表格",
    "Sort actresses by": "演员排序方式",
    "Sort: Name": "排序：名称",
    "Sort: Japanese Name": "排序：日文名",
    "Sort: Database ID": "排序：数据库 ID",
    "Sort: DMM ID": "排序：DMM ID",
    "Sort: Updated Time": "排序：更新时间",
    "Sort: Created Time": "排序：创建时间",
    "Asc": "升序",
    "Toggle sort direction": "切换排序方向",
    "0 selected": "已选择 0 项",
    "Select Page": "选择本页",
    "Merge Selected": "合并所选",
    "Select actress for merge": "选择演员用于合并",
    "Edit": "编辑",
    "Delete": "删除",
    "Prev": "上一页",
    "Next": "下一页",
    "Genre Replacements": "类型替换",
    "Manage genre name replacements applied during scraping": "管理刮削时应用的类型名称替换。",
    "Add a new genre replacement rule": "添加新的类型替换规则",
    "Original": "原文",
    "Replacement": "替换为",
    "e.g., HD": "例如 HD",
    "e.g., High Definition": "例如 High Definition",
    "Add": "添加",
    "Search by original or replacement...": "按原文或替换内容搜索...",
    "Toggle sort order": "切换排序",
    "A-Z": "A-Z",
    "Actions": "操作",
    "Replacements take effect on the next scrape. Existing movies are not retroactively updated.": "替换规则会在下次刮削时生效，已有影片不会自动回溯更新。",
    "Word Replacements": "词语替换",
    "Manage word replacements for uncensoring metadata strings": "管理用于还原元数据字符串的词语替换。",
    "Add a new word replacement rule": "添加新的词语替换规则",
    "e.g., R**e": "例如 R**e",
    "e.g., Rape": "例如 Rape",
    "Configure Javinizer scraping and output options": "配置 Javinizer 刮削与输出选项。",
    "Reload": "重新加载",
    "Save Changes": "保存更改",
    "Server Settings": "服务器设置",
    "Configure API server host, port, and system paths": "配置 API 服务器主机、端口和系统路径。",
    "Scraper Defaults": "刮削器默认值",
    "Default settings applied to all scrapers unless overridden per-scraper": "应用到所有刮削器的默认设置，除非单独覆盖。",
    "Browser Settings": "浏览器设置",
    "Configure browser automation for scrapers that require JavaScript rendering. Browser must be enabled both globally here and per-scraper in Scraper Settings.": "配置需要 JavaScript 渲染的刮削器浏览器自动化。浏览器需要在此全局启用，并在刮削器设置中对单个刮削器启用。",
    "Scraper Settings": "刮削器设置",
    "Enable/disable scrapers and configure user agent. Scraper priority is managed in Metadata Priority section.": "启用/禁用刮削器并配置 User-Agent。刮削优先级在元数据优先级中管理。",
    "Metadata Priority": "元数据优先级",
    "Configure which scraper to use for each metadata field": "配置每个元数据字段使用哪个刮削器。",
    "Completeness Scoring": "完整度评分",
    "Configure which metadata fields are essential, important, or nice-to-have for completeness scoring": "配置哪些元数据字段在完整度评分中属于必要、重要或可选。",
    "Control how Javinizer organizes and moves your files": "控制 Javinizer 如何整理和移动文件。",
    "Output Settings": "输出设置",
    "Configure output paths, templates, and download options": "配置输出路径、模板和下载选项。",
    "Database Settings": "数据库设置",
    "Configure database options and behavior": "配置数据库选项和行为。",
    "API Tokens": "API 令牌",
    "Manage API tokens for programmatic access to the Javinizer API": "管理用于程序化访问 Javinizer API 的令牌。",
    "Translate aggregated metadata to a target language using configurable providers": "使用可配置服务商将聚合元数据翻译到目标语言。",
    "NFO Settings": "NFO 设置",
    "Configure NFO metadata file generation for Kodi/Plex compatibility": "配置兼容 Kodi/Plex 的 NFO 元数据文件生成。",
    "Proxy and Flaresolverr Settings": "代理与 FlareSolverr 设置",
    "Configure global proxy fallback, reusable proxy profiles, and FlareSolverr for Cloudflare bypass": "配置全局代理兜底、可复用代理配置和用于绕过 Cloudflare 的 FlareSolverr。",
    "Performance Settings": "性能设置",
    "Configure worker pool and performance tuning options": "配置工作池和性能调优选项。",
    "File Matching Settings": "文件匹配设置",
    "Configure file scanning, extensions, and ID extraction patterns": "配置文件扫描、扩展名和番号提取规则。",
    "Logging Settings": "日志设置",
    "Configure logging level, format, and output destination": "配置日志级别、格式和输出位置。",
    "MediaInfo Settings": "MediaInfo 设置",
    "Configure MediaInfo CLI fallback for media file analysis": "配置用于媒体文件分析的 MediaInfo CLI 兜底。",
    "Web UI": "Web UI",
    "Configure web interface preferences": "配置 Web 界面偏好。",
    "Host": "主机",
    "Port": "端口",
    "Security": "安全",
    "Allowed Origins": "允许的来源",
    "Allowed Directories": "允许访问的目录",
    "Denied Directories": "禁止访问的目录",
    "Max Files Per Scan": "每次扫描最大文件数",
    "Scan Timeout Seconds": "扫描超时时间（秒）",
    "Rate Limit": "速率限制",
    "Requests Per Minute": "每分钟请求数",